{
 "slug": "2026-10-23-8-dgx-sparks-1-tb-frontier-mod",
 "topic": "Eight NVIDIA DGX Sparks clustered into 1 TB of unified memory running the GLM 5.3 753B frontier model",
 "title": "8 DGX Sparks, 1 TB: frontier AI on a desk",
 "description": "Working description; the package stage overwrites this. Eight DGX Sparks now cluster into 1 TB of unified memory and run the full GLM 5.3 (753B) at about 470 GB in NVFP4. You'll learn what the cluster really buys: capacity, not speed. (Narration is AI-generated.)",
 "hashtags": [
  "#DGXSpark",
  "#NVIDIA",
  "#GLM",
  "#LocalAI",
  "#AICluster",
  "#BuildLocalAI",
  "#FrontierModels",
  "#UnifiedMemory"
 ],
 "hook_text": "1 TB on your desk",
 "hook_candidates": [
  "One terabyte of memory, on your desk.",
  "Eight desk boxes now hold what a datacenter rents.",
  "NVIDIA just blessed an eight-Spark cluster.",
  "Your desk just got a terabyte of model memory.",
  "753B parameters, zero datacenter.",
  "A frontier model now runs on eight desk boxes.",
  "Eight Sparks, one terabyte, one cable.",
  "Eight DGX Sparks replaced the datacenter rental.",
  "The four hundred seventy gigabyte file on a desk.",
  "Eight little boxes, one frontier model, no cloud."
 ],
 "style_pack": "silicon",
 "script_format": "classic",
 "structure": "news-react-so-what",
 "value_types": "TEACHES,REFRAMES",
 "target_duration_s": 36,
 "narration_full": "One terabyte of memory just shrank to your desk. NVIDIA now supports linking eight DGX Sparks, desk-side AI computers, into one shared pool. Your gaming PC or Mac watched models this size from a browser tab. That pool runs G L M five point three, seven hundred fifty-three billion parameters. The whole model is one four hundred seventy gigabyte file on a desk. The catch: the cable between boxes is eleven times slower than the memory inside each one. You buy room, not speed. And yet it types at thirty-one tokens per second in NVIDIA's own test, no cloud account. The frontier moved from their building to your desk.",
 "music_mood": "steady-build",
 "scenes": [
  {
   "id": "s01",
   "role": "hook",
   "tool": "hyperframes",
   "layout_archetype": "giant-number",
   "narration": "One terabyte of memory just shrank to your desk.",
   "on_screen_text": "1 TB | on your desk",
   "visual_brief": "Frame 1: giant digits '1 TB' centered in a dark silicon slab frame, fully legible at frame 1, chrome fab-marks faint at slab corners. Motion onset t=0.30s: the digits scale up 1.0 to 1.06 and settle (fade/scale only, no edge travel). On the narration word 'desk' the sub-line 'on your desk' fades in below the digits. One text block animating at a time; amber accent underline draws under '1 TB' last 0.5 s.",
   "est_duration_s": 3.1,
   "render_notes": "Silicon pack. Content text in headline class only. Last frame rhymes with s01: digits-in-slab returns in s05.",
   "sfx": [
    {
     "at": "number-reveal",
     "name": "ding"
    }
   ]
  },
  {
   "id": "s02",
   "role": "explain",
   "tool": "hyperframes",
   "layout_archetype": "diagram-flow",
   "narration": "NVIDIA now supports linking eight DGX Sparks, desk-side AI computers, into one shared pool. Your gaming PC or Mac watched models this size from a browser tab.",
   "on_screen_text": "8 DGX Sparks | one shared pool",
   "visual_brief": "Eight small iso slabs enter as a 2x4 grid, staggered fade-in-place, max two animating at once. On 'one shared pool' amber link lines draw slab to slab, forming one pool outline that brightens while individual slabs dim slightly. On 'browser tab' a thin chrome tab glyph fades in at the edge, then dims. Hard cut to next scene; no cross-dissolve of text.",
   "est_duration_s": 9.3,
   "render_notes": "Viewer-situation beat: browser tab is chrome, never content text."
  },
  {
   "id": "s03",
   "role": "explain",
   "tool": "hyperframes",
   "layout_archetype": "split-compare",
   "narration": "That pool runs G L M five point three, seven hundred fifty-three billion parameters. The whole model is one four hundred seventy gigabyte file on a desk.",
   "on_screen_text": "GLM 5.3 | 753B parameters | 470 GB file",
   "visual_brief": "Split layout: left panel types 'GLM 5.3' with '753B parameters' beneath (hard cut between the two text beats, typewriter allowed). Right panel: a horizontal memory bar in slab style fills with amber on 'four hundred seventy gigabyte file', '470 GB file' label above it. The bar fills once, no loop. Number lands with the amber fill; nothing else moves during the fill.",
   "est_duration_s": 9.3,
   "sfx": [
    {
     "at": "number-reveal",
     "name": "pop"
    }
   ]
  },
  {
   "id": "s04",
   "role": "explain",
   "tool": "hyperframes",
   "layout_archetype": "centered-stack",
   "narration": "The catch: the cable between boxes is eleven times slower than the memory inside each one. You buy room, not speed.",
   "on_screen_text": "cable ~11x slower | room, not speed",
   "visual_brief": "Centered stack: two slabs with a thin amber trace between them (the cable) above a wide lane inside one slab (its own memory). On 'eleven times slower' the cable trace flashes amber once while the inner lane stays solid: the contrast is the picture. On 'room, not speed' the cable trace dims and the pooled outline from s02 fades back in behind, still. At most two elements animate at once.",
   "est_duration_s": 7.2
  },
  {
   "id": "s05",
   "role": "payoff_close",
   "tool": "hyperframes",
   "layout_archetype": "giant-number",
   "narration": "And yet it types at thirty-one tokens per second in NVIDIA's own test, no cloud account. The frontier moved from their building to your desk.",
   "on_screen_text": "31 tokens/sec | your desk, not theirs",
   "visual_brief": "Giant digits '31' with 'tokens/sec' beneath, same slab frame as frame 1 (rhyme). On 'NVIDIA's own test' a small chrome vendor tag fades in and out. On 'your desk' the digits settle and the amber underline returns under the number, then the wordmark settle takes the final 0.5 s. Video stops within a second of the last spoken word.",
   "est_duration_s": 8.6,
   "sfx": [
    {
     "at": "number-reveal",
     "name": "ding"
    }
   ]
  }
 ],
 "notes_for_review": "Reviewer: 'eleven times slower' is the 196 Gb/s link vs 273 GB/s inside one Spark (brief claim 8, rounded); 'thirty-one tokens per second' is NVIDIA's vendor benchmark, attributed in the narration; the ~$55,600 cluster cost and the 816B/Q8 fit stay unspoken (Unverified). 'G L M five point three' is pre-spoken for the voice engine."
}